id,cluster,title
req-heuristic-0001,4,EVSIDS-MTF/PhaseBoost (EMPB): Activity-Recency-Phase Hybrid Branching
req-heuristic-0002,4,Phase-Weighted Activity with Recency (PWAR)
req-heuristic-0003,0,EVSIDS-MTF Hybrid Score (EMHS): Phase-Aware Temporal Activity Branching
req-heuristic-0004,4,RESTART-PHASED HYBRID ACTIVITY (RPHA) Heuristic
req-heuristic-0005,4,R-ACE (Recency-Augmented Conflict-Exploration) Heuristic
req-heuristic-0006,1,STAGE: Stability-Timestamp-Guided EVSIDS Branching
req-heuristic-0007,0,Phase-Aware Adaptive Recency-Weighted EVSIDS (PARWE)
req-heuristic-0008,4,RECAPS: Recent Conflict and Activity Phase-Scoring
req-heuristic-0009,3,EVSIDS-TQBF: Timestamp-Queued Branch Frequency Heuristic
req-heuristic-0010,3,Phase-Adaptive Timestamped Activity (PATA) Heuristic
req-heuristic-0011,1,STAMP: Stable-Timestamp Activity Mixing for Propagation
req-heuristic-0012,4,Conflict-Phase Adaptive Queue Score (CPAQS)
req-heuristic-0013,4,Phase-Aware Conflict-Weighted Timestamp Scoring (PACT)
req-heuristic-0014,4,EVCB: Exponentially-Weighted VSIDS with Conflict-Bump Backoff
req-heuristic-0015,1,DYNASCORE: Dynamic Activity & Recency-Weighted Branching
req-heuristic-0016,3,RECAPS: Recency- and Conflict-Aware Phase-Scored Branching
req-heuristic-0017,5,EVSBUMP: EVSIDS-Bump Hybrid Branching Heuristic
req-heuristic-0018,4,RECAPS: Recency- and Conflict-Aware Phase-Scored branching
req-heuristic-0019,4,PHASE-WEIGHTED RESTART-AWARE SCORING (PHASER)
req-heuristic-0020,6,FAST-Phase Adaptive Score Timestamping (FAST-PAST) Heuristic
req-heuristic-0021,4,Dynamic Phase-Aware EVSIDS (DPA-EVSIDS)
req-heuristic-0022,1,ABES: Activity-Burst with Early-Staleness Branching
req-heuristic-0023,6,Dynamic Conflict-Time-Centric Scoring (DyCTS)
req-heuristic-0024,6,Phase-Aware Recent-Conflict Boosting (PARCB) Heuristic
req-heuristic-0025,4,RELEVANT–RECENCY Variable Scoring (R2VS)
req-heuristic-0026,1,EVSMT: Exponentially-Weighted Stable-Move-To-Front Heuristic
req-heuristic-0027,4,"""Conflict-Phase Adaptive Activity (CPAA) Heuristic"""
req-heuristic-0028,1,SCORE-ADAPT: Stability-Conditioned Ordered Ranking with EVSIDS and Recency
req-heuristic-0029,4,Phase-Aware Conflict-Temporal (PACT) Heuristic
req-heuristic-0030,4,"EVCBT: EVSIDS-Value, Conflict-Boosted Timestamp Heuristic"
req-heuristic-0031,4,DYN-EVSIDS-TQ: Dynamic EVSIDS-Timestamped Queue Branching
req-heuristic-0032,0,PHASE-AWARE ACTIVITY WITH RECENCY (PAAR)
req-heuristic-0033,1,EVSIDS-Recency Hybrid (ERH) Branching Heuristic
req-heuristic-0034,3,AMPHIBIAN – Adaptive Multi-Phase Hybrid Branching via Incremental Activity and Novelty
req-heuristic-0035,0,EVSIDS-MTF Hybrid with Adaptive Phase-Aware Prioritization (EMAP)
req-heuristic-0036,4,Phase-Aware Recency-Weighted Activity (PARWA)
req-heuristic-0037,3,EVSIDS-Biased Temporal Impact (EBTI) Heuristic
req-heuristic-0038,1,EVSIDS-Bump Hybrid (EBH): Adaptive Recency-Weighted Branching
req-heuristic-0039,4,Phase-Adaptive Temporal Activity Score (PATAS)
req-heuristic-0040,3,EVSIDS-Bump Hybrid (EBH) Heuristic
req-heuristic-0041,4,Phase-Aware Conflict-Time Weighted Branching (PACTWB)
req-heuristic-0042,0,RECAP: Recency- and Conflict-Adaptive Priority Heuristic
req-heuristic-0043,1,DAS-BRANCH: Dual-Activity & Staleness Branching
req-heuristic-0044,4,MIRA: Multi-Impact Recency-Augmented Branching Heuristic
req-heuristic-0045,4,DVSIDS-MTF: Decaying VSIDS with Move-to-Front Recency Bias
req-heuristic-0046,4,Phase-Age Weighted EVSIDS (PAWS)
req-heuristic-0047,1,EVCB: Exponentially-Weighted VSIDS with Conflict-Bump Bias
req-heuristic-0049,4,DRVS – Dynamic Recency-Weighted Variable Selection
req-heuristic-0050,4,EVSIDS-Recency Hybrid (ERH) Branching Heuristic
req-heuristic-0051,4,Phase-Aware Adaptive Queue Score (PAQS) Heuristic
req-heuristic-0052,4,Stability-Weighted Activity with Recency Boost (SWAR-B)
req-heuristic-0053,6,Phase-Aware Conflict-Temporal (PACT) Branching Heuristic
req-heuristic-0054,4,EVSIDS-Timestamp Hybrid (ETH) Branching Heuristic
req-heuristic-0055,4,REACTIVSIDS (Recency-Enhanced Adaptive Conflict and Timestamped VSIDS)
req-heuristic-0056,0,PHASE-BOOSTED RECENCY-ACTIVITY (PBRA) Heuristic
req-heuristic-0057,6,EVSIDS-MTF Hybrid Priority (EMHP) Heuristic
req-heuristic-0058,4,EVSIDS-PhaseTrail Hybrid (EPTH) Heuristic
req-heuristic-0059,4,EVSIDS-Recency Phase-Aware Hybrid (ERPAH)
req-heuristic-0060,1,RECAPS: Recency-Enhanced Conflict Activity Priority Scoring
req-heuristic-0061,2,EVSIDS-Age Momentum (EAM) Branching
req-heuristic-0062,3,Hybrid Adaptive Recency-Impact Score (HARIS)
req-heuristic-0063,1,EVRAT: Exponentially-Weighted VSIDS with Recency and Adaptive Tie-breaking
req-heuristic-0064,4,RSM-EV: Recency-Scaled Max-EVSIDS Heuristic
req-heuristic-0065,1,Dual-Phase Temporal Activity Selection (DPTAS)
req-heuristic-0066,4,Recency-Weighted EVSIDS (RW-EVSIDS)
req-heuristic-0067,6,REVIS – Recency-Enhanced VSIDS with Inactivity Suppression
req-heuristic-0068,4,RECAPS: Recency- and EVSIDS-Combined Adaptive Phase-Scoring
req-heuristic-0069,1,EVSBQ: Exponential VSIDS-Boosted Queue Heuristic
req-heuristic-0070,1,EVSIDS-Timestamp Hybrid (ETH) Branching
req-heuristic-0071,5,DASH: Dynamic Activity and Stability Hybrid
req-heuristic-0072,3,QVSIDS-MTF: Queue-Weighted VSIDS with Move-To-Front Boost
req-heuristic-0073,4,EVWAF: Exponential Variable-Weighted Activity with Freshness
req-heuristic-0074,3,STRIDE: Stable-Timestamped Reinforced Interleaved Decision Engine
req-heuristic-0075,1,RIBS: Recency-Impact Balanced Scoring
req-heuristic-0076,4,EVCB: Exponential VSIDS-Conflict-Bump Hybrid
req-heuristic-0077,3,Fused Adaptive Recency-Activity (FARA) Branching
req-heuristic-0078,4,RECAPS — Recency- and Conflict-Adjusted Phase Scoring
req-heuristic-0079,3,RATIO: Recency-Adjusted Temporal Impact Ordering
req-heuristic-0080,3,REVS: Recency-Enhanced VSIDS with Adaptive Phase Steering
req-heuristic-0081,2,Phase-Aware Adaptive Conflict-Recency (PACR) Heuristic
req-heuristic-0082,6,Phase-Aware Conflict-EVSIDS (PACE)
req-heuristic-0083,1,Stabilized Activity & Freshness Branching (SAFB)
req-heuristic-0084,1,Phase-Guided Recency-Weighted EVSIDS (PGRW-EVSIDS)
req-heuristic-0085,6,Phase-Aware EVSIDS-Recency (PAER) Branching
req-heuristic-0086,6,SCORE-MIX: Conflict-Time-Weighted EVSIDS (CTW-EVSIDS)
req-heuristic-0087,6,Reinforced Timestamped Activity Selection (RTAS)
req-heuristic-0088,4,RECAP: Recency- and Conflict-Adjusted Priority
req-heuristic-0089,4,RECENT-ACT: Recency-Weighted EVSIDS Branching
req-heuristic-0090,6,Diversity-Weighted EVSIDS with Recency (DWER)
req-heuristic-0091,6,Phase-Guided Timestamped EVSIDS (PT-EVSIDS)
req-heuristic-0092,0,RMS-Phase Adaptive Branching (RMS-PAB)
req-heuristic-0093,1,DASH: Dual-Activity Scoring with History
req-heuristic-0094,4,RECAPS: Recency- and EVSIDS-Combined Adaptive Phase-Scoring
req-heuristic-0095,1,EVSIDS-MTF Hybrid with Adaptive Phase-Recency (EMAP)
req-heuristic-0096,4,Phase-Aware Conflict History Branching (PACHiB)
req-heuristic-0097,0,Phase-Weighted Adaptive Recency-Impact Selection (PARIS)
req-heuristic-0098,4,EVSIDS-QB Hybrid (EQB): Queue-Biased Activity Branching
req-heuristic-0099,1,EVSIDS-Recency Hybrid (ERH) Branching
req-heuristic-0100,6,EVSIDS-Phase Momentum (EPM) Heuristic
req-heuristic-0101,3,PaRS-VMTF: Phase-aware Recency-Scaled VSIDS with Variable Move-To-Front
req-heuristic-0102,0,Phase-Weighted Activity Queue (PWAQ) Heuristic
req-heuristic-0103,1,REVSID-MTF: Recency-Weighted EVSIDS with Move-to-Front Bias
req-heuristic-0104,4,RECAPS: Recency-Enhanced Conflict and Activity Prioritized Scoring
req-heuristic-0105,5,Conflict-Phase Timestamp Integration (CPTI) Heuristic
req-heuristic-0106,0,Stability-Aware Activity Decay Hybrid (SADH)
req-heuristic-0107,3,PHASE-AWARE RECENT ACTIVITY (PARA) Heuristic
req-heuristic-0108,4,Dual-Phase Adaptive Recency-Impact (DARI) Heuristic
req-heuristic-0109,4,DYN-MIX: Dynamic Multi-Signal Branching
req-heuristic-0110,5,RACE: Recency-Augmented Conflict-Exploration Heuristic
req-heuristic-0111,0,Phase-Guided Dual-Activity Branching (PGDAB)
req-heuristic-0112,2,PHASED-EVSIDS/RECENCY (PER) Heuristic
req-heuristic-0113,1,Recency-Weighted Phase-Aware EVSIDS (ReWiPE)
req-heuristic-0114,4,PHASED-IMPACT EVSIDS (PIE) Heuristic
req-heuristic-0115,4,Adaptive Conflict-Phase Weighted EVSIDS (ACP-EVSIDS)
req-heuristic-0116,4,EVSIDS-MTF Fusion (EMF Branching Heuristic)
req-heuristic-0117,1,Adaptive Conflict Queue-Weighted Activity (ACQWA)
req-heuristic-0118,4,EVSIDS-Phase-Recency Hybrid (EPRH) Heuristic
req-heuristic-0119,4,EVSIDS-MTF Hybrid Activity Score (EMHAS)
req-heuristic-0120,0,Phase-Aware Temporal Activity (PATA) Heuristic
req-heuristic-0121,4,DynaPhase-Impact Score (DPIS) Heuristic
req-heuristic-0122,6,RECENT-IMPACT SAT (RISAT) Heuristic
req-heuristic-0123,4,REACTIV (Recency-Enhanced Activity and Conflict-Time Integrated Variable Selection)
req-heuristic-0124,0,Phase-Aware Conflict Recency Scoring (PACRS)
req-heuristic-0125,4,---
req-heuristic-0126,6,Phase-Aware Time-Weighted EVSIDS (PaTW-EVSIDS) Heuristic
req-heuristic-0127,6,EVSIDS-MTF Hybrid Heuristic (EMH): Conflict-Recency-Guided Branching
req-heuristic-0128,6,EVSIDS-Recency Hybrid (ERH): Recency-Weighted Activity Branching
req-heuristic-0129,0,DASV: Dynamic Activity–Staleness Voting
req-heuristic-0130,4,Phase-Aware Conflict Momentum (PACM) Heuristic
req-heuristic-0131,3,EVSIDS-Recency Hybrid (ERH): Adaptive Activity-Recency Branching
req-heuristic-0132,4,Phase-Impact Adaptive Scoring (PIAS)
req-heuristic-0133,1,EVSIDS-Recency Adaptive Scoring (ERAS)
req-heuristic-0134,6,Phase-Aware Adaptive Recency Activity (PARA) Heuristic
req-heuristic-0135,0,CBLVS: Conflict-Biased Lookback Variable Scoring
req-heuristic-0136,3,RVSIDS-MTF: Recency-Weighted VSIDS with Move-To-Front Smoothing
req-heuristic-0137,4,Conflict-Phased Activity Reweighting (CPAR)
req-heuristic-0138,0,PHaT-EVSIDS: Phase-aware Hybrid Activity and Timestamp EVSIDS
req-heuristic-0139,1,Recency-Weighted Adaptive Stability (RWAS) Heuristic
req-heuristic-0140,0,REVSIDS-QBF: Recency-Enhanced VSIDS with Queue-Based Feedback
req-heuristic-0141,4,Phase-Aware Conflict Impact (PACI) Heuristic
req-heuristic-0142,4,RECAPS: Recency-Enhanced Conflict and Activity Priority Scoring
req-heuristic-0143,2,Phase-Adaptive Temporal Activity (PATA) Heuristic
req-heuristic-0144,5,Adaptive Conflict-Phase Scoring (ACPS)
req-heuristic-0145,1,PHASED-IMPACT HYBRID (PIH) Branching Heuristic
req-heuristic-0146,4,STAGE: Stability- and Timestamp-Adjusted Guided Exploration
req-heuristic-0147,1,RECHARGE: Recency-Enhanced Conflict History Adaptively Ranked Guided Exploration
req-heuristic-0148,6,Phase-Aware Activity Timestamping (PAT) Heuristic
req-heuristic-0149,4,Phase-Aware Hybrid Recency-Activity (PHRA) Heuristic
req-heuristic-0150,1,Recency-Weighted EVSIDS (RW-EVSIDS) Heuristic
req-heuristic-0151,2,Phase-Aware Adaptive Recency Scoring (PAARS)
req-heuristic-0152,4,EVSIDS-Freshness Hybrid (EFH) Heuristic
req-heuristic-0153,1,Dual-Phase Activity Timestamp (DPAT)
req-heuristic-0154,4,Phase-Weighted Queue-EVSIDS (PWQE) Heuristic
req-heuristic-0155,0,Phase-Integrated Recent Activity Scoring (PIRAS)
req-heuristic-0156,0,Phase-Aware Conflict History Scoring (PACHS)
req-heuristic-0157,0,Reinforced Phase-Aware EVSIDS (RPEVSIDS)
req-heuristic-0158,6,RECENT-IMPACT SCORE (RIS): Recency-Weighted EVSIDS for Adaptive Branching
req-heuristic-0159,1,RVSIDS-MT: Recency- and Variability-Weighted Scoring with Immediate Decision Support
req-heuristic-0160,1,Adaptive Activity-Recency Hybrid (AARH) Heuristic
req-heuristic-0161,4,PHASE-ACT: Phase-Guided Activity and Recency Heuristic
req-heuristic-0162,4,Phase-Adaptive Queue-Weighted Activity (PAQWA)
req-heuristic-0163,1,RECAPS – Recent Conflict Adaptive Phase-Weighted Scoring
req-heuristic-0164,1,Phase-Aware Timestamp-EVSIDS Hybrid (PAT-EVSIDS)
req-heuristic-0165,4,DASHSAT: Decay-Adaptive Scoring with Hybrid Stability for SAT
req-heuristic-0166,1,STABLE-BUMP Hybrid Activity Heuristic (SBAH)
req-heuristic-0167,1,FASB: Frequency-Adapted Stability Branching
req-heuristic-0168,6,Phase-Aware Conflict-Centrality (PACC) Heuristic
req-heuristic-0169,1,RECENT-C (Recency-Enhanced Conflict Contribution Heuristic)
req-heuristic-0170,1,RECENT-IMPACT EVSIDS (RIE): Recency-Weighted Conflict-Driven Branching
req-heuristic-0171,0,PHAB: Phase-aware Hybrid Activity & Bump Heuristic
req-heuristic-0172,4,Phase-Guided Recent Activity Scoring (PGRAS)
req-heuristic-0173,4,EVSIDS-Timestamp Hybrid (ETH) Heuristic
req-heuristic-0174,1,EVSIDS-Recency Hybrid (ERH): Activity-Recency Combined Branching
req-heuristic-0175,1,Phase-Aware Conflict History Branching (PACHB)
req-heuristic-0176,4,E2VSIDS-MTF: Exponential EVSIDS with Move-To-Front Recency Boost
req-heuristic-0177,2,Phase-Aware Activity Timestamping (PAAT) Heuristic
req-heuristic-0178,4,RECAPS: Recency-Enhanced Conflict Activity Priority Selection
req-heuristic-0179,4,Phase-Aware Hybrid EVSIDS/Recency (PHAER) Heuristic
req-heuristic-0180,5,STAMP-CHB: Stable Timestamp-Activity Mean Priority with Conflict History Blending
req-heuristic-0181,0,Phase-Aware Conflict-Temporal Scoring (PACT)
req-heuristic-0182,4,FAST-BALANCE (Frequency-Adapted Stable Timestamp Branching)
req-heuristic-0183,2,Stability-Aware Recent Impact (SARI) Branching Heuristic
req-heuristic-0184,0,Phase-Aware Timestamped Activity Selection (PATAS)
req-heuristic-0185,4,EVSIDS-MTF Hybrid Branching (EMH)
req-heuristic-0186,1,S2BVS: Stable-Stage Biased Variable Selection
req-heuristic-0187,1,EV-SMTF: Exponential VSIDS with Scaled Move-To-Front
req-heuristic-0188,0,Phase-Aware Recency-Weighted EVSIDS (PARWE)
req-heuristic-0189,6,Phase-Aware Timestamped Hybrid Activity (PATHA) Heuristic
req-heuristic-0190,4,Phase-Aware Hybrid Activity Queue (PHAQ)
req-heuristic-0191,6,RECAPS: Recency-Enhanced Conflict Activity and Phase Stabilized Branching
req-heuristic-0192,1,RECAPS: Recency-Enhanced Conflict Activity Priority Selection
req-heuristic-0193,1,SAW+Q: Stability-Aware Weighted Queue Heuristic
req-heuristic-0194,4,RELEVANCE-BOUNDED DYNAMIC PHASE-AWARE BRANCHING (RBDPAB)
req-heuristic-0195,3,Evict-Most-Conflicted-Target (EMCT) Heuristic
req-heuristic-0196,4,RAVS: Recency-Adjusted Variable Scoring
req-heuristic-0197,1,DASH: Dynamic Activity and Staleness Hybrid
req-heuristic-0198,4,SCORE-Q: Queue-Augmented EVSIDS Branching
req-heuristic-0199,1,REVSQUID: Recency-Enhanced Variable Scoring with Quick Unstable/Stable Integration and Dynamic Tie-breaking
req-heuristic-0200,4,STRIDE: Stochastic Timestamp-Ranked Integrated Dynamic EVSIDS
req-heuristic-0201,1,DASH: Dynamic Activity-Stability Hybrid
req-heuristic-0202,6,EVSIDS-Stability Hybrid with Conflict Recency Boost (ESCRB)
req-heuristic-0203,4,"DASH: Dynamic Activity, Stability, and History Heuristic"
req-heuristic-0204,3,RECENT-CONFLICT PHASE-AWARE EVSIDS (RC-PAE)
req-heuristic-0205,0,REACTIVSIDS: Recency-and-Activity-Integrated VSIDS
req-heuristic-0206,6,Dual-Phase Conflict-Temporal Scoring (DPCTS)
req-heuristic-0207,4,MIRA – Move-to-Front Informed Relevance Activity Heuristic
req-heuristic-0208,1,Phase-Guided Temporal EVSIDS (PGT-EVSIDS)
req-heuristic-0209,6,Phase-Aware Dynamic Activity Queue (PADAQ) Heuristic
req-heuristic-0210,4,RECHARGE-VSIDS: Recency- and Conflict-Heightened Activity Guided Decision
req-heuristic-0211,4,EVRMS: Exponential VSIDS with Recency-Move-to-Front Scoring
req-heuristic-0212,1,Phase-Aware Temporal EVSIDS (PATEVSIDS) Heuristic
req-heuristic-0213,0,Dual-Phase Adaptive Timestamped Activity (DATSA) Heuristic
req-heuristic-0214,4,RECAP: Recency-Enhanced Conflict Activity Priority
req-heuristic-0215,4,Phase-Aware Conflict-Temporal Activity (PACT) Heuristic
req-heuristic-0216,1,DYNASCORE: Dynamic Activity and Recency-Weighted Branching
req-heuristic-0217,1,STAGE: Stable-Timestamped Adaptive Global Exploration
req-heuristic-0218,0,"DASH: Dynamic Activity, Staleness, and History Heuristic"
req-heuristic-0219,4,DYNAMIC PHASE-BUFFERED CONFLICT-AGE (DPBCA) Heuristic
req-heuristic-0220,4,Dual-Phase Activity Recency Heuristic (DPARH)
req-heuristic-0221,1,Phase-Aware Time-Weighted EVSIDS (PATWE)
req-heuristic-0222,4,EVSIDS-QBF: Queue-Weighted EVSIDS Branching
req-heuristic-0223,2,EVSIDS-Recency Hybrid (ERH) Heuristic
req-heuristic-0224,1,RECAPS: Recency-Enhanced Conflict Activity Priority Scoring
req-heuristic-0225,3,Phase-Aware Conflict-Temporal Scoring (PACT)
req-heuristic-0226,0,Phase-Aware Conflict History Branching (PACHB)
req-heuristic-0227,3,DYNASCORE: Dynamic Activity and Recency Weighted Branching
req-heuristic-0228,1,Dynamic Phase-Aware Recency-Weighted EVSIDS (DyPhase-RWEVSIDS)
req-heuristic-0229,4,STRIDE: Stability-Triggered Recency-Impact Decaying Evaluation
req-heuristic-0230,6,DYNAMIC PHASE-ADAPTIVE SCORE FUSION (DyPAS-F)
req-heuristic-0231,4,RECAPS — Recency- and EVSIDS-Combined Adaptive Phase Scoring
req-heuristic-0232,2,Phase-Aware Conflict History Branching (PACHB)
req-heuristic-0233,0,RECAPS: REcent CAuse and Phase Synergy Heuristic
req-heuristic-0234,4,EVSIDS-Recency Hybrid (ERH) Branching Heuristic
req-heuristic-0235,4,RECAPS: Recency and EVSIDS Combined Adaptive Phase-Scoring
req-heuristic-0236,5,SCORE-MIX: Conflict-Phase Hybrid Branching Heuristic
req-heuristic-0237,3,Stability-Adaptive Timestamped EVSIDS (SATE)
req-heuristic-0238,4,Phase-Weighted Adaptive Recency Impact (PWARI)
req-heuristic-0239,1,STRIDE: Stable-Timestamped Reinforced Inference-Driven Exploration
req-heuristic-0240,0,EVSBUMP: Phase-aware EVSIDS-Recency Hybrid Branching
req-heuristic-0241,3,Phase-Aware Conflict-Temporal Scoring (PACT)
req-heuristic-0242,5,Phase-Aware Adaptive Recency-Impact Score (PARIS)
req-heuristic-0243,2,Phase-Aware Conflict History (PACH) Heuristic
req-heuristic-0244,6,EVSIDS-Recency-Phase (ERP) Branching
req-heuristic-0245,4,Phase-Adaptive EVSIDS with Recency Boost (PAERB)
req-heuristic-0246,4,Phase-Aware Dual Activity Selection (PADAS)
req-heuristic-0247,4,Phase-Aware Temporal Activity Scoring (PATAS)
req-heuristic-0248,5,Phase-Aware Adaptive Conflict Tracking (PACT)
req-heuristic-0249,1,Phase-Weighted Adaptive Queue Scoring (PAQS)
req-heuristic-0250,3,"""Conflict-Phase Adaptive Scoring (CPAS)"""
req-heuristic-0251,5,Reinforced Phase-Aware Conflict History (RePACH) Heuristic
req-heuristic-0252,3,Phase-Aware Conflict-Weighted Queue (PACQ)
req-heuristic-0253,1,Phase-Aware Timestamped EVSIDS (PAT-EVSIDS) Heuristic
req-heuristic-0254,2,EVSIDS-Recency Hybrid (ERH) Heuristic
req-heuristic-0255,6,SERA: Synergistic EVSIDS-Recency Adaptive Heuristic
req-heuristic-0256,1,RECAPS – Recency- and EVSIDS-Combined Adaptive Phase Scoring
req-heuristic-0257,0,PHASE-AWARE RECENT CONFLICT-FOCUSED EVSIDS (PARCE)
req-heuristic-0258,1,Phase-Aware Hybrid Activity and Recency (PHAReR) Heuristic
req-heuristic-0259,3,Dual-Phase Adaptive Conflict Score (DPACS)
req-heuristic-0260,4,EVSIDS-Recency Phase-Guided (ERPG) Heuristic
req-heuristic-0262,1,EVSIDS-Bump Hybrid with Recency Awareness (EBRA)
req-heuristic-0263,5,DynPhaseScore (Dynamic Phase-Weighted Activity Selection)
req-heuristic-0264,1,RECBRANCH: Recency-Enhanced Conflict Branching
req-heuristic-0265,6,RECENT-IMPACT EVSIDS (RIEVSIDS)
req-heuristic-0266,5,PHASED-EVSIDS/Recency Hybrid (PERCH) Heuristic
req-heuristic-0267,1,REACTIVS: Recency-Enhanced Adaptive Conflict-Tracking VSIDS
req-heuristic-0268,4,Phase-Aware Conflict-Time Weighted Activity (PACTWA)
req-heuristic-0269,1,EVSIDS-Recency Hybrid (ERH): Conflict-Active Recency Scoring
req-heuristic-0270,0,EVA-QS: Exponentially-Weighted Activity & Queue Synthesis
req-heuristic-0271,4,"""Phase-Aware Conflict History Score (PACHOS)"""
req-heuristic-0272,1,EVSIDS-Momentum Hybrid (EMH) Branching Heuristic
req-heuristic-0273,4,RECAPS: REcent Conflict-Activity Phase-Sensitive Branching
req-heuristic-0274,3,PHASE-AWARE DYNAMIC ACTIVITY BUMPING (PADAB)
req-heuristic-0275,0,Reinforced Adaptive Stability Heuristic (RASH)
req-heuristic-0276,3,RECENT-IMPACT HYBRID (RIH) Branching Heuristic
req-heuristic-0277,0,Stabilized Conflict-Phase Impact Search (SCOPIS)
req-heuristic-0278,0,EVSIDS-Recency Hybrid (ERH) Branching Heuristic
req-heuristic-0279,4,Stability-Aware Activity & Recency Heuristic (SARAH)
req-heuristic-0280,6,Phase-Aware Timestamped Activity Selection (PATAS)
req-heuristic-0281,4,RECENCY-BOOSTED ADAPTIVE EVSIDS (RBAE)
req-heuristic-0282,0,DynaPhase-Recency Variable Selection (DPRVS)
req-heuristic-0283,4,EVSIDS-Recency Hybrid (ERH): Conflict Activity–Recency Balanced Branching
req-heuristic-0284,6,Stability-Aware Timestamped Activity (SATA) Heuristic
req-heuristic-0285,4,STAMP: Stable-Adaptive Multi-Phase Branching
req-heuristic-0286,4,RECAPS – Recency-Enhanced Conflict Activity with Phase Stabilization
req-heuristic-0287,6,"REACTIVSIDS: Recency-Enhanced, Activity-Targeted VSIDS"
req-heuristic-0288,4,Recency-Aware Adaptive Activity (RAAA) Branching
req-heuristic-0289,0,Stabilized Conflict-Phase Impact Score (SCPIS)
req-heuristic-0290,4,PHASE-AWARE RECENCY SCALED IMPACT (PARSI) Heuristic
req-heuristic-0291,4,RECENT-IMPACT Weighted Activity Selection (RIWAS)
req-heuristic-0292,1,RECAPS: Recency- and EVSIDS-Combined Adaptive Phase-Sensitive Branching
req-heuristic-0293,4,EVSIDS-Recency Hybrid (ERH): Conflict-Driven Activity-Recency Branching
req-heuristic-0294,6,DRMA: Dual-Recency & Multiplicative Activity Heuristic
req-heuristic-0295,4,Stochastic Timestamped Activity Branching (STAB)
req-heuristic-0296,4,EVSIDS-BumpRecency Hybrid (EBRH): Adaptive Activity-Recency Branching
req-heuristic-0297,4,REVSIDS-MTF: Recency-Enhanced Variable State Independent Decaying Sum with Move-To-Front Boost
req-heuristic-0298,0,Phase-Aware Temporal Activity (PATA) Heuristic
req-heuristic-0299,1,DynaPhase Activity-Queue Heuristic (DPAQ)
req-heuristic-0300,1,EVCB: Exponentially-Weighted VSIDS with Conflict-Based Backboost
req-heuristic-0301,4,"DASH: Dynamic Activity, Stability, and History Branching"
req-heuristic-0302,4,REACTIVSIDS: Recency and Activity Integrated Variable Selection with Dynamic Scaling
req-heuristic-0303,3,EVSIDS-Recency Hybrid (ERH) Branching Heuristic
req-heuristic-0304,1,Phase-Aware Conflict Momentum (PACM) Heuristic
req-heuristic-0305,5,Phase-Aware Timestamped EVSIDS (PATE)
req-heuristic-0306,4,SCORE-MIX: Recency-Weighted EVSIDS Branching
req-heuristic-0307,4,Staged Adaptive Activity and Recency (STAAR) Branching
req-heuristic-0308,3,RECAPS – Recency-Enhanced Conflict Activity with Phase Sensitivity
req-heuristic-0309,4,EVSIDS-Recency Hybrid with Adaptive Phase (ERA-Phase) Heuristic
req-heuristic-0310,1,Hybrid Adaptive Recency-EVSIDS (HARE) Heuristic
req-heuristic-0311,1,EVSIDS-RECENCY Hybrid (ERH): Activity-Recency Adaptive Branching
req-heuristic-0312,4,Phase-Aware Conflict History Weighted Score (PACHWS)
req-heuristic-0313,2,EVSIDS-QBF: Queue-Boosted Activity with Adaptive Phase
req-heuristic-0314,1,RECENT-ACT: Recency-Weighted EVSIDS Branching
req-heuristic-0315,4,EVSIDS-MTF Hybrid with Adaptive Recency Scaling (EMARS)
req-heuristic-0316,3,RECAPS: Recency-Calibrated Activity Phase Scoring
req-heuristic-0317,1,Phase-Aware Conflict History (PACH) Branching
req-heuristic-0318,1,DYNAMIC PHASE-ACTIVITY QUEUE (DPAQ) Heuristic
req-heuristic-0319,4,EVSIDS-MTF Adaptive Branch (EMA-Branch)
req-heuristic-0320,3,STAGE: Stability-Aware Timestamp-Guided Activity with Global Exploration
req-heuristic-0321,3,Phase-Guided Timestamped Activity Selection (PGTAS)
req-heuristic-0322,1,EVSIDS-Phase Impact with Recency (EPIR) Heuristic
req-heuristic-0323,1,Phase-Adaptive Temporal Activity (PATA) Heuristic
req-heuristic-0324,3,STABLE-DYNAMIC PHASE-FOCUSED BRANCHING (SDPFB)
req-heuristic-0325,0,Phase-Aware Conflict & Recency Score (PACRS)
req-heuristic-0326,0,DSER (Dynamic Stability-Exploration Ranking) Heuristic
req-heuristic-0327,4,PHASE-DYN: Phase-Aware Dynamic Recency-Weighted Branching
req-heuristic-0328,4,EVSIDS-Recency Hybrid (ERH) Branching Heuristic
req-heuristic-0329,6,EVCB: Exponential-Variance Conflict Bumper
req-heuristic-0330,2,Phase-Aware Dual-Score Branching (PADSB)
req-heuristic-0331,0,PHASE-ADAPTIVE RECENCY-ACTIVITY (PARA) BRANCHING
req-heuristic-0332,1,REACTIVSIDS — Recency- and Activity-Integrated VSIDS
req-heuristic-0333,4,EVSIDS-Frontier Adaptive Branching (E-FAB)
req-heuristic-0334,6,Phase-Aware Temporal Activity (PATA) Branching Heuristic
req-heuristic-0335,0,Phase-Guided Dual-Activity (PGDA) Branching Heuristic
req-heuristic-0336,4,EVSIDS-Bump Hybrid with Recency-Aware Prioritization (EBRAP)
req-heuristic-0337,1,RISS — Recency-Impact Scaled Scoring Heuristic
req-heuristic-0338,1,Phase-Aware Timestamp-Weighted Activity (PATWA)
req-heuristic-0339,1,RECENCY-ACTIVITY PHASE-AWARE (RAPA) Heuristic
req-heuristic-0340,4,"""Phase-Aware Temporal EVSIDS"" (PATEVSIDS)"
req-heuristic-0341,5,RARESAT: Recency-And-Reward Enhanced SAT Branching
req-heuristic-0342,3,Phase-Aware Recent-Conflict Activity (PARCA) Heuristic
req-heuristic-0343,0,Phase-Aware Timestamped Activity (PATA) Heuristic
req-heuristic-0345,0,Phase-Aware Conflict-EVSIDS (PACE)
req-heuristic-0346,4,PHASED-EVSIDS-MTF (Phase-aware EVSIDS with Move-to-Front Boost)
req-heuristic-0347,5,Phase-Aware Timestamped EVSIDS (PATE)
req-heuristic-0348,1,EVSIDS-Recency Hybrid (ERH): Adaptive Activity-Recency Branching
req-heuristic-0349,1,EVSIDS-MTF Hybrid Activity (EMHA) Branching
req-heuristic-0350,0,Phase-Guided Activity Relevance (PGAR)
req-heuristic-0351,4,Phase-Guided Activity with Temporal Penalty (PGATP)
req-heuristic-0352,1,EVSIDS-Recency Hybrid (ERH) Branching Heuristic
req-heuristic-0353,0,Stabilized Adaptive Timestamped Activity (SATA) Heuristic
